{
  "schemaVersion": 2,
  "generatedAtUtc": "2026-06-10T00:00:00.0000000Z",
  "tool": {
    "name": "CodeMetrics.AI",
    "version": "1.1.0",
    "ecosystem": "dotnet"
  },
  "subject": {
    "root": "/repo",
    "entryPoint": "/repo/MyApp.slnx",
    "name": "MyApp",
    "variant": "Debug"
  },
  "filters": {
    "totalUnits": 2,
    "analyzedUnits": 1,
    "skipped": [
      { "name": "MyApp.Tests", "reason": "Test project" }
    ]
  },
  "population": {
    "types": 1,
    "members": 1
  },
  "dimensions": {
    "codeQuality": { "status": "scored", "score": 10, "basis": "Example.", "findings": [] },
    "maintainability": { "status": "scored", "score": 10, "basis": "Example.", "findings": [] },
    "errorHandling": { "status": "scored", "score": 10, "basis": "Example.", "findings": [] },
    "performanceAsync": { "status": "scored", "score": 10, "basis": "Example.", "findings": [] },
    "security": { "status": "scored", "score": 10, "basis": "Example.", "findings": [] },
    "testing": { "status": "scored", "score": 10, "basis": "Example.", "findings": [] },
    "documentation": { "status": "scored", "score": 10, "basis": "Example.", "findings": [] },
    "dependencyManagement": { "status": "skipped", "basis": "Dependency probe skipped.", "findings": [] },
    "architecture": { "status": "scored", "score": 10, "basis": "Example.", "findings": [] }
  }
}
